"","productId","price","brand","name","desc","category","mens","avg_rating","avg_size","avg_backpacking","avg_dayhiking","avg_trail_running","avg_running","cushion","weight","sales"
"497",201773,200,"HOKA","HOKA Men's Tecton X Trail-Running Shoes","Built for speed and bolstered by Vibram Megagrip, the HOKA Tecton X men's trail-running shoes incorporate propulsive carbon fiber plates to unleash seismic potential on rugged trails.","running shoes",1,4.71428571428571,11,0,0,0.0714285714285714,0.0714285714285714,"High",4.06958561809137,10.8148964757276
"498",201775,140,"HOKA","HOKA Men's Kawana Road-Running Shoes","Named after the Gold Coast's famous beach break, the men's HOKA Kawana road-running shoes feel as great as a day by the shore. They're smooth, well-balanced and ready to log some miles.","general shoes",0,4.32460732984293,11.7,0,0,0.0209424083769634,0.0209424083769633,"Medium",3.09391500180586,9.83922702962252
"499",201986,150,"Merrell","Merrell Men's Moab 3 Mid Waterproof Hiking Boots","The Mother Of All Boots gets upgraded in the men's Merrell Moab 3 Mid waterproof hiking boots. Known for comfort and versatility, the latest iteration is even softer, grippier and more supportive.","hiking",0,4.46875,11.1136363636364,0.171875,0.328125,0,0,"High",3.66641503501556,10.8453033143022
"500",201987,130,"Merrell","Merrell Men's Moab 3 Mid Hiking Boots","Continuing tradition, the men's Merrell Moab 3 Mid hiking boots offer out-of-the-box comfort, durability and versatility—like their predecessors. This version is softer, grippier and more supportive.","hiking",0,4.63,10.6923076923077,0.01,0.14,0,0,"Medium",3.29207875174463,10.3941047542492
"501",201988,140,"Merrell","Merrell Men's Moab 3 Waterproof Hiking Shoes","Wet out? No bother. Go farther with the men's Merrell Moab 3 Waterproof hiking shoes. Known for comfort, durability and versatility, the latest iteration is softer, grippier and more supportive.","hiking",0,4.61428571428571,10.4,0.0285714285714286,0.3,0,0,"High",3.6000829941303,10.4795456456247
"502",201989,120,"Merrell","Merrell Men's Moab 3 Hiking Shoes","Go farther outdoors with the men's Merrell Moab 3 hiking shoes. Known for comfort, durability and versatility, the latest iteration is even softer, grippier and more supportive.","hiking",0,4.38372093023256,10.2105263157895,0.104651162790698,0.197674418604651,0,0,"Medium",3.11990638047719,9.93307680138448
"503",202080,170,"Merrell","Merrell Women's Moab 3 Mid GORE-TEX Hiking Boots","Known for its comfort and durability, the latest version of the women's Merrell Moab 3 Mid GORE-TEX hiking boots give you the cushion and support you want so you can focus on the trail not your feet.","hiking",0,4.15151515151515,8.2,0.0606060606060606,0.121212121212121,0,0,"Medium",3.44545518825907,9.92612587174858
"504",202121,150,"Merrell","Merrell Women's Moab 3 Mid Waterproof Hiking Boots","The Mother Of All Boots gets upgraded in the women's Merrell Moab 3 Mid waterproof hiking boots. Known for comfort and versatility, the latest iteration is even softer, grippier and more supportive.","hiking",0,4.41269841269841,8.3421052631579,0.111111111111111,0.301587301587302,0,0,"High",3.60125200159737,10.7184072411952
"505",202122,130,"Merrell","Merrell Women's Moab 3 Mid Hiking Boots","Continuing tradition, Merrell Moab 3 Mid women's hiking boots offer out-of-the-box comfort, durability and versatility—like their predecessors. This version is softer, grippier and more supportive.","hiking",0,4.58333333333333,8.35714285714286,0.145833333333333,0.291666666666667,0,0,"High",3.46177479818285,10.4432249858705
"506",202123,130,"Merrell","Merrell Women's Bravada 2 Waterproof Hiking Shoes","Treat your feet to the trail-ready shoes you deserve. For comfort on the trails, Merrell Bravada 2 Waterproof women's hiking shoes fit like sneakers and hug the ankles without stiffness or pinching.","hiking",0,4.42592592592593,8.33333333333333,0,0,0,0,"Medium",2.99892090419072,10.0135774523862
"507",202124,140,"Merrell","Merrell Women's Moab 3 Waterproof Hiking Shoes","Wet out? No bother. Go farther with the women's Merrell Moab 3 Waterproof hiking shoes. Known for comfort, durability and versatility, the latest iteration is softer, grippier and more supportive.","hiking",0,4.74285714285714,8.0625,0,0.157142857142857,0,0,"Medium",3.4869815216915,11.1332485779595
"508",202125,110,"Merrell","Merrell Women's Bravada 2 Hiking Shoes","Treat your feet to the trail-ready shoes you deserve. For comfort on the trails, the women's Merrell Bravada 2 hiking shoes fit like sneakers and hug the ankles without stiffness or pinching.","hiking",0,4.35294117647059,8.5,0,0.0392156862745098,0,0,"Low",2.78820730825176,10.1831607123025
"509",202126,120,"Merrell","Merrell Women's Moab 3 Hiking Shoes","Go farther outdoors with the women's Merrell Moab 3 hiking shoes. Known for comfort, durability and versatility, the latest iteration is even softer, grippier and more supportive.","hiking",0,4.74324324324324,8.21875,0.0540540540540541,0.216216216216216,0,0,"Medium",3.34238793593378,10.7514714026456
"510",202580,175,"La_Sportiva","La Sportiva Women's Akasha II Trail-Running Shoes","Delivering a blend of cushion, response and traction, the women's La Sportiva Akasha II trail-running shoes excel on technical terrain and high-mileage outings.","general shoes",0,4.53333333333333,8.3,0,0,0.933333333333333,0.866666666666667,"High",5.23084841068978,10.85942933028
"511",202607,160,"Nike","Nike Women's React Infinity Run Flyknit 3 Road-Running Shoes","Keep chasing after your running goals with the women's Nike React Infinity Run Flyknit 3 road-running shoes. The soft, stable support will keep you going mile after mile after mile.","general shoes",0,4.15094339622642,7.5,0,0,0,0,"Medium",3.1784462631781,10.2228305918136
"512",202608,99.93,"Nike","Nike Men's Air Zoom Terra Kiger 8 Trail-Running Shoes","Lock in and go with the no-frills Nike Air Zoom Terra Kiger 8 men's trail-running shoes. Stability meets agility to travel light and tight over tough terrain while keeping your ride soft and springy.","running shoes",1,5,12.5,0,0,0.5,0,"Low",2.98382726427968,10.318538273312
"513",202615,130,"Altra","Altra Women's Rivera 2 Road-Running Shoes","From training blocks to your weekly long run, the updated Altra Rivera 2 women's running shoes are daily trainers that let you go with the flow—every day, every run, every road.","running shoes",0,4.01754385964912,8.38888888888889,0,0,0.157894736842105,0.087719298245614,"Low",2.94293159918906,10.2485591661754
"514",202616,140,"Altra","Altra Women's Provision 6 Road-Running Shoes","Redesigned to be sleeker, softer and more responsive, the women's Altra Provision 6 road-running shoes help you bounce from long, dreamy weekend miles to catching up with friends over coffee.","running shoes",0,4.11538461538461,9,0,0,0.0384615384615385,0.0256410256410256,"Medium",2.9874331577355,10.2414000795391
"515",202617,180,"Altra","Altra Women's Mont Blanc Trail-Running Shoes","Inspired by the highest mountain in the Alps, the women's Altra Mont Blanc trail-running shoes feature max cushion that's designed for long, hard trail runs.","general shoes",0,3.49056603773585,8.55555555555556,0,0,0.169811320754717,0.113207547169811,"Medium",3.25348330851705,9.02107979671333
"516",202618,140,"Altra","Altra Women's Lone Peak 6 Trail-Running Shoes","Enhance your trail-running experience with the women's updated Altra Lone Peak 6 shoes, which offer more protection from underfoot rocks as you traverse new and favorite trails.","running shoes",0,4.42241379310345,8.275,0,0,0.344827586206897,0.28448275862069,"Medium",3.65742734533273,10.8473503390244
"517",202619,160,"Altra","Altra Women's Timp 4 Trail-Running Shoes","Take a step off the beaten path with the women's Altra Timp 4 trail-running shoes—ultra-cushioned trail cruisers that are ready for any adventure.","general shoes",0,3.33333333333333,8.4875,0,0,0.272108843537415,0.156462585034014,"Medium",3.02931509833448,9.54439150630889
"518",202639,130,"Altra","Altra Men's Rivera 2 Road-Running Shoes","From training blocks to your weekly long run, the updated Altra Rivera 2 men's running shoes are daily trainers that let you go with the flow—every day, every run, every road.","running shoes",1,3.75,12,0,0,0.0535714285714286,0.0714285714285715,"Low",2.76365815144334,9.64821832712373
"519",202641,140,"Altra","Altra Men's Lone Peak 6 Trail-Running Shoes","Enhance your trail-running experience with the men's updated Altra Lone Peak 6 shoes, which offer more protection from underfoot rocks as you traverse new and favorite trails.","running shoes",1,4.125,11.0681818181818,0,0,0.328125,0.140625,"Medium",3.21503659322945,9.04642699898703
"520",202642,180,"Altra","Altra Men's Mont Blanc Trail-Running Shoes","Inspired by the highest mountain in the Alps, the men's Altra Mont Blanc trail-running shoes feature max cushion that's designed for long, hard trail runs.","general shoes",0,3.4040404040404,10.1153846153846,0,0,0.131313131313131,0.111111111111111,"Medium",3.20163742632087,8.6521675861711
"521",202643,160,"Altra","Altra Men's Timp 4 Trail-Running Shoes","Take a step off the beaten path with the men's Altra Timp 4 trail-running shoes—ultra-cushioned trail cruisers that are ready for any adventure.","general shoes",0,3.13768115942029,10.9722222222222,0,0,0.260869565217391,0.173913043478261,"Medium",2.95498147135246,8.41331404488588
"522",202661,175,"La_Sportiva","La Sportiva Men's Akasha II Trail-Running Shoes","Delivering a blend of cushion, response and traction, the men's La Sportiva Akasha II trail-running shoes excel on technical terrain and high-mileage outings.","general shoes",0,4.4,10.5714285714286,0,0,0.933333333333333,0.866666666666667,"High",5.15720094026451,11.0358992796952
"523",202663,185,"La_Sportiva","La Sportiva Women's Ultra Raptor II GTX Trail-Running Shoes","The all-terrain La Sportiva Ultra Raptor II GTX women's trail-running shoes are perfect for long-distance adventures off the beaten path—especially when you need traction in unpredictable weather.","running shoes",0,5,10,0,0,1,0,"High",3.92360581064129,11.2080032667967
"524",202664,155,"La_Sportiva","La Sportiva Women's Ultra Raptor II Trail-Running Shoes","Made for long-distance runs and ventures off the beaten path, the women's La Sportiva Ultra Raptor II trail-running shoes feature full-length rock guards and ultra-sticky rubber outsoles.","running shoes",0,4.45454545454545,8.14285714285714,0,0,0.636363636363636,0.545454545454545,"High",4.34540495944055,11.4298878477877
"525",202667,155,"La_Sportiva","La Sportiva Men's Ultra Raptor II Trail-Running Shoes","Made for long-distance runs and ventures off the beaten path, the men's La Sportiva Ultra Raptor II trail-running shoes feature full-length rock guards and ultra-sticky rubber outsoles.","running shoes",1,5,11.75,0,0,1,1,"High",5.52543829239084,11.8122208882255
"526",202739,189,"La_Sportiva","La Sportiva Men's TX Hike Mid GTX Hiking Boots","End the day with happy feet—whether you've spent it off-road or sightseeing in town. The men's La Sportiva TX Hike Mid GTX boots combine the support of a boot with the agility of a trail-running shoe.","hiking",0,4.19047619047619,10.675,0.619047619047619,0.80952380952381,0,0,"High",4.56398810110099,10.7018636911785
"527",202740,219,"La_Sportiva","La Sportiva Men's Ultra Raptor II Mid Leather GTX Hiking Boots","Designed from the inside out to withstand the harshest conditions, the men's La Sportiva Ultra Raptor II Mid Leather GTX hiking boots are ideal for hikers who need boots to handle the daily grind.","hiking",0,4.25,10.8333333333333,0.25,0.75,0,0,"High",4.85156393799965,10.5725184203297
"528",202794,60,"Merrell","Merrell Moab Speed Low A/C Waterproof Shoes","For kids who need a lightweight sneaker that can hold up to outdoorsy adventures, the kids' Merrell Moab Speed Low A/C waterproof shoes are a versatile and comfy option that come in fun colors, too.","hiking",0,2.88888888888889,6.5,0,0,0,0,"Low",1.37663079176749,8.56776047930695
"529",202857,259,"La_Sportiva","La Sportiva Women's Trango TRK GTX Hiking Boots","Looking for the climbing prowess of a mountaineering boot in a lightweight scrambler? La Sportiva Trango TRK GTX women's hiking boots are fully waterproof and ready for tough trails in any conditions.","hiking",0,4.5,9.25,0,0.5,0,0,"High",5.10933008448808,10.8873663589198
"530",202858,189,"La_Sportiva","La Sportiva Women's TX Hike Mid GTX Hiking Boots","End the day with happy feet after spending it off-road—or sightseeing in town. The women's La Sportiva TX Hike Mid GTX boots combine the support of a boot with the agility of a trail-running shoe.","hiking",0,4.47368421052632,8.07894736842105,0.526315789473684,0.947368421052632,0,0,"High",4.89807812984719,10.5195837963709
"531",202859,219,"La_Sportiva","La Sportiva Women's Ultra Raptor II Mid Leather GTX Hiking Boots","Designed from the inside out to withstand the harshest conditions, the women's La Sportiva Ultra Raptor II Mid Leather GTX hiking boots are ideal for hikers who need boots to handle the daily grind.","hiking",0,4.57142857142857,7.85714285714286,0.571428571428571,0.857142857142857,0,0,"High",5.16719595410794,10.0098832996593
"532",202860,179,"La_Sportiva","La Sportiva Women's Ultra Raptor II Leather GTX Hiking Shoes","Designed from the inside out to withstand harsh conditions, the women's La Sportiva Ultra Raptor II Leather GTX hiking shoes are ideal for hikers who want reliable protection on rough, wet trails.","hiking",0,4,9,0.4,1,0,0,"High",4.59379779151122,10.8215317137869
"533",202861,259,"La_Sportiva","La Sportiva Men's Trango TRK GTX Hiking Boots","Looking for the climbing prowess of a mountaineering boot in a lightweight scrambler? La Sportiva Trango TRK GTX men's hiking boots are fully waterproof and ready for tough trails in any conditions.","hiking",0,3.66666666666667,10.5,1,0.666666666666667,0,0,"High",4.86383851640386,9.26870873861941
"534",202862,179,"La_Sportiva","La Sportiva Men's Ultra Raptor II Leather GTX Hiking Shoes","Designed from the inside out to withstand harsh conditions, the men's La Sportiva Ultra Raptor II Leather GTX hiking shoes are ideal for hikers who want reliable protection on rough, wet trails.","hiking",0,4.5,9.75,0,1,0,0,"High",4.86997580560597,10.8682026247413
"535",202893,160,"Salomon","Salomon Women's OUTpulse Mid GORE-TEX Hiking Boots","When you don't have time to tiptoe over creeks, the women's Salomon OUTpulse Mid GORE-TEX hiking boots propel you forward, delivering premium energy return and a fluid stride in a waterproof package.","hiking",0,4.23684210526316,8.3,0.421052631578947,0.921052631578947,0,0,"High",4.41297387070392,11.1224570863033
"536",202895,150,"Salomon","Salomon Women's X Ultra Pioneer Mid CSWP Hiking Boots","Waterproof, grippy and flexible enough to head anywhere, the women's Salomon X Ultra Pioneer Mid CSWP hiking boots keep you moving through steep terrain, sudden storms and more.","hiking",0,4,9.25,0.333333333333333,0.666666666666667,0,0,"High",3.84382105101392,10.0164428553938
"537",202897,140,"Salomon","Salomon Women's OUTpulse GORE-TEX Low Hiking Shoes","Ready to propel you on your outdoor adventures, the women's Salomon OUTpulse GORE-TEX Low hiking shoes mix protective grip with cushioning, energy return and shelter from the elements.","hiking",0,4,8.96,0.04,0.84,0,0,"High",3.95674717233266,10.3714781399213
"538",202978,49.83,"Teva","Teva Men's Wyldland Sneakers","A hike-inspired sneaker teeming with retro styling, the Teva Wyldland makes less impact on the planet by enlisting a mix of recycled and bio-based materials that stand up to your in-town adventures.","general shoes",0,3.78571428571429,10.875,0,0,0,0,"Low",1.75964848980369,10.4558721204745
"539",203050,160,"Salomon","Salomon Men's OUTpulse Mid GORE-TEX Hiking Boots","When you don't have time to tiptoe over creeks, the men's Salomon OUTpulse Mid GORE-TEX hiking boots propel you forward, delivering premium energy return and a fluid stride in a waterproof package.","hiking",0,4.1219512195122,10.1625,0.341463414634146,0.902439024390244,0,0,"High",4.32552340838894,10.8341642684612
"540",203052,150,"Salomon","Salomon Men's X Ultra Pioneer Mid CSWP Hiking Boots","Waterproof, grippy and flexible enough to head anywhere, the men's Salomon X Ultra Pioneer Mid CSWP hiking boots keep you moving through steep terrain, sudden storms and more.","hiking",0,4,11.25,0.6,1,0,0,"High",4.27343129516131,10.8306603706738
"541",203192,175,"Oboz","Oboz Women's Sawtooth X Mid Waterproof Hiking Boots","Dial up your hiking plans—the women's Oboz Sawtooth X Mid Waterproof hiking boots have all the fixings to support and protect your feet as you tromp through puddles and take on new challenges.","hiking",0,3.73684210526316,8.38571428571429,0.289473684210526,0.81578947368421,0,0,"High",4.16683627217737,10.0337383050717
"542",203193,160,"Oboz","Oboz Women's Sawtooth X Mid Hiking Boots","Head for the hills or find a trail closer to home. The women's Oboz Sawtooth X Mid hiking boots straddle the crossroads of a light hiker and a full-leather traditional boot.","hiking",0,5,7.75,0,0.5,0,0,"High",4.29184316276763,10.7434483136749
"543",203194,160,"Oboz","Oboz Women's Sawtooth X Low Waterproof Hiking Shoes","Even more capable than the original, the women's Oboz Sawtooth X Low Waterproof hiking shoes retain the same great fit and let you take on wet trails with improved comfort, traction and durability.","hiking",0,3.18987341772152,8.58904109589041,0.20253164556962,0.746835443037975,0,0,"High",3.61013793810337,8.90276552022181
"544",203195,135,"Oboz","Oboz Women's Sawtooth X Low Hiking Shoes","Retaining all the things the original made popular, the women's Oboz Sawtooth X Low hiking shoes offer aggressive styling and updated materials for improved comfort, traction and durability.","hiking",0,3.3,8.27777777777778,0.2,0.95,0,0,"High",3.6566337303497,9.79231695784411
"545",203211,159.95,"Danner","Danner Men's Panorama Waterproof Mid Hiking Boots","Designed to take you farther, the men's Danner Panorama waterproof mid hiking boots are comfortable, stable and ready to keep your feet dry and happy when the trails get muddy.","hiking",0,4.57142857142857,9.92307692307692,0.357142857142857,0.785714285714286,0,0,"High",4.42280414678456,11.7964424926642
"546",203213,159.95,"Danner","Danner Men's South Rim 600 Shoes","Explore trails or urban enclaves through the heat of the day in the men's Danner South Rim 600 shoes. Their suede and textile uppers are lined with Air Mesh for comfort in warmer temperatures.","hiking",0,3.66666666666667,11.1666666666667,0.333333333333333,0.666666666666667,0,0,"High",3.76962122456046,10.0239150294892
"547",203215,149.95,"Danner","Danner Men's Panorama Waterproof Low Hiking Shoes","Water bottle, check. Day-use permit, check. Reliable hiking shoes, check. The men's Danner Panorama Waterproof Low hiking shoes are comfortable, stable and ready to keep your feet dry on muddy trails.","hiking",0,3.5,12.5,0,0.5,0,0,"High",3.35228555881729,9.71311998481168
"548",203226,159.95,"Danner","Danner Women's Panorama Waterproof Mid Hiking Boots","Designed to take you farther, the women's Danner Panorama waterproof mid hiking boots are comfortable, stable and ready to keep your feet dry and happy when the trails get muddy.","hiking",0,4.5,9.25,0.5,0.5,0,0,"High",4.01511279264469,10.8029379920736
"549",203230,175,"Oboz","Oboz Men's Sawtooth X Mid Waterproof Hiking Boots","Dial up your hiking plans—the men's Oboz Sawtooth X Mid Waterproof hiking boots have all the fixings to support and protect your feet as you tromp through puddles and take on new challenges.","hiking",0,3.82608695652174,10.8928571428571,0.41304347826087,0.717391304347826,0,0,"High",4.08931261909814,9.94241463808049
"550",203331,160,"Oboz","Oboz Men's Sawtooth X Mid Hiking Boots","Whether you decide to head for the hills or find a trail closer to home, the men's Oboz Sawtooth X Mid hiking boots can hold up to the challenge of daily strolls or reaching every summit on your map.","hiking",0,3,8.5,0.5,0.5,0,0,"High",3.18713110638863,8.52494037437139
"551",203332,160,"Oboz","Oboz Men's Sawtooth X Low Waterproof Hiking Shoes","Even more capable than the original, the men's Oboz Sawtooth X Low Waterproof hiking shoes retain the same great fit and let you take on wet trails with improved comfort, traction and durability.","hiking",0,3.53448275862069,10.7592592592593,0.224137931034483,0.775862068965517,0,0,"High",3.83789539247396,10.9613496553046
"552",203333,135,"Oboz","Oboz Men's Sawtooth X Low Hiking Shoes","Retaining all the things the original made popular, the men's Oboz Sawtooth X Low hiking shoes offer aggressive styling and updated materials for improved comfort, traction and durability.","hiking",0,3.38235294117647,10.9365079365079,0.205882352941176,0.647058823529412,0,0,"High",3.31168197549018,9.53375824977059
"553",203363,75,"KEEN","KEEN Targhee Mid Waterproof Hiking Boots - Little Kids'","Tough and gritty on the trail, the KEEN Targhee Mid Waterproof hiking boots for little kids offer mid-height ankle support, performance and traction for leading the way on family hikes.","hiking",0,3,10.5,0,0,0,0,"Low",1.60371049224539,8.81866544374149
"554",203364,75,"KEEN","KEEN Targhee Mid Waterproof Hiking Boots - Big Kids'","Tough and gritty on the trail, the KEEN Targhee Mid Waterproof hiking boots for big kids offer mid-height ankle support, performance and traction for leading the way on family hikes.","hiking",0,3.66666666666667,7.33333333333333,0,0,0,0,"Low",1.97194784437173,8.92573598110735
"555",203366,60,"KEEN","KEEN Speed Hound Shoes","KEEN Speed Hound kids' shoes are hybrid shoes with grippy, tire-inspired tread. Toe-to-heel protection makes them the perfect kids' bike or skating shoes for ear-to-ear grins.","general shoes",0,5,4,0,0,0,0,"Low",2.54271574016754,11.0041009398594
"556",203406,170,"Brooks","Brooks Men's Hyperion Max Road-Running Shoes","From speed work to tempo runs, the men's Hyperion Max road-running shoes are light and responsive for training at top speed. Lace them up for races or hard workouts for extra pep in your stride.","general shoes",0,4.51162790697674,13,0,0,0.0116279069767442,0.0116279069767442,"Medium",3.51062333840193,10.1193999425458
"557",203451,109.95,"Brooks","Brooks Men's Caldera 6 Trail-Running Shoes","Just because you are running on rocks, roots and ruts doesn't mean your feet should feel beat up. The men's Brooks Caldera 6 trail-running shoes are made for cushioned comfort even on rough trails.","general shoes",0,4.44444444444444,11.75,0,0,0.0185185185185185,0.0185185185185185,"Low",2.82345580590253,9.92363444527144
"558",203550,135,"Oboz","Oboz Men's Bozeman Low Suede Shoes","You want comfortable sneakers when you're headed into the big (or small) city. The men's Oboz Bozeman Low Suede shoes give you the all-day comfort and performance that turn any sidewalk into a trail.","general shoes",0,4.57142857142857,11.2857142857143,0,0,0,0,"Medium",3.13452577037058,10.2942888598318
"559",203627,160,"New_Balance","New Balance Women's Fresh Foam 1080 v12 Road-Running Shoes","Made to go the distance, the women's New Balance Fresh Foam 1080 v12 road-running shoes feature top-of-the-line performance technology designed to keep you comfortable as you put in the miles.","general shoes",0,4.26153846153846,8.1,0,0,0.153846153846154,0.0923076923076922,"Medium",3.41798760022167,9.57820953079707
"560",203629,135,"New_Balance","New Balance Women's Fresh Foam 880v12 Road-Running Shoes","Reliable workhorses for logging miles, women's New Balance Fresh Foam 880v12 road-running shoes are updated with improved heel cushioning and responsiveness for a 360° approach to sustained comfort.","running shoes",0,5,7.75,0,0,1,1,"High",5.30449588111504,11.681078930928
"561",203656,130,"Saucony","Saucony Women's Peregrine 12 Trail-Running Shoes","Over an ounce lighter than its predecessor, the women's Saucony Peregrine 12 trail-running shoes are lighter, faster and more comfortable than ever, so your trail runs can be exponentially more fun.","running shoes",0,3.70769230769231,8.66666666666667,0,0,0.0769230769230769,0.0615384615384615,"Low",2.721169226198,9.56755067594311
"562",203671,170,"Brooks","Brooks Women's Hyperion Max Road-Running Shoes","From speed work to tempo runs, the women's Hyperion Max road-running shoes are light and responsive for training at top speed. Lace them up for for extra pep in your stride for races or hard workouts.","general shoes",0,4.62352941176471,9.5,0,0,0.0117647058823529,0.0117647058823529,"Medium",3.57269727508561,10.5260953917898
"563",203673,160,"Brooks","Brooks Women's Glycerin GTS 20 Road-Running Shoes","Combining soft cushioning with that just-right amount of support, the women's Glycerin GTS 20 road-running shoes are made to give you a smooth, comfortable ride with a stable landing on every stride.","general shoes",0,4.36496350364964,9.5,0,0,0.0072992700729927,0.00729927007299271,"Medium",3.31077284505878,10.3201204112777
"564",203676,109.95,"Brooks","Brooks Women's Caldera 6 Trail-Running Shoes","Just because you're running on rocks, roots and ruts doesn't mean your feet should feel beat up. The women's Brooks Caldera 6 trail-running shoes are made for cushioned comfort even on rough trails.","general shoes",0,4.07954545454545,8.5,0,0,0.0113636363636364,0.0113636363636364,"Low",2.60806950113924,10.2560611902351
"565",203678,160,"New_Balance","New Balance Men's Fresh Foam 1080 v12 Road-Running Shoes","Featuring top-of-the-line performance technology designed to keep you comfortable as you put in the miles, the men's New Balance Fresh Foam 1080 v12 road-running shoes are made to go the distance.","general shoes",0,4.21052631578947,10.9545454545455,0,0,0.236842105263158,0.184210526315789,"Medium",3.56748152930859,10.097336357871
