"","productId","price","brand","name","desc","category","mens","avg_rating","avg_size","avg_backpacking","avg_dayhiking","avg_trail_running","avg_running","cushion","weight","sales"
"707",209763,130,"Altra","Altra Women's Escalante 3 Road-Running Shoes","Wit engineered knit uppers and a refined shape, the women's Altra Escalante 3 road-running shoe are designed to set your feet in a natural position for a comfortable jog with proper form.","general shoes",0,3.31443298969072,8.78571428571429,0,0,0.0206185567010309,0.0103092783505155,"Low",2.40491145272233,9.47579180215253
"708",209764,150,"Altra","Altra Women's Torin 6 Road-Running Shoes","If you're looking for a zero drop, lightweight and cushioned option that can hold up to some serious miles, the women's Altra Torin 6 road-running shoes are a pair that can go the distance with you.","running shoes",0,3.32450331125828,8.58333333333333,0,0,0.0860927152317881,0.0463576158940397,"Low",2.70110657474109,9.18532346409486
"709",209766,170,"Altra","Altra Women's Vanish Tempo Road-Running Shoes","Comfort meets speed in the women's Altra Vanish Tempo road-running shoes. They're built on the Slim FootShape™ last for a snug, comfortable fit—ready for fast-paced races or training runs.","general shoes",0,4.05555555555556,9.25,0,0,0.111111111111111,0.0555555555555555,"Medium",3.34363198104232,9.85318718673304
"710",209767,210,"Altra","Altra Women's Mont Blanc Boa Trail-Running Shoes","Inspired by the highest mountain in the Alps, the women's Altra Mont Blanc Boa trail-running shoes feature max cushion that's designed for long, hard trail runs and Boa lacing for a secure fit.","general shoes",0,4.1,8.25,0,0,0.2,0.1,"High",3.89598800923182,9.79763358393727
"711",209768,170,"Altra","Altra Women's Olympus 5 Trail-Running Shoes","When it comes to the trail, the women's Altra Olympus 5 trail-running shoes are ready for rugged terrain so you can feel confident in your footing and enjoy the scenery—you've earned that view.","general shoes",0,3.48125,8.83333333333333,0,0,0.15625,0.1,"Medium",3.11233289423796,8.71106987633457
"712",209798,125,"Sorel","Sorel Women's Out 'N About III Mid Waterproof Sneakers","Rain or shine, these boots are ready for adventure. The women's Sorel Out 'N About III Mid Waterproof sneakers help you prepare for puddles, muck and mud.","general shoes",0,4.53012048192771,8.71428571428571,0,0,0,0,"Medium",3.00123779248389,11.3233500707296
"713",209849,190,"Salomon","Salomon Quest Winter Thinsulate ClimaSalomon Waterproof Boots","Winter ready, the Salomon Quest Winter Thinsulate ClimaSalomon waterproof boots have everything you need for the cold and snow: 400 g Thinsulate™ insulation and ClimaSalomon™ waterproof membranes.","hiking",0,5,12,0,0,0,0,"High",3.97884141346024,10.0921833683725
"714",209913,160,"Salomon","Salomon Men's Speedcross 6 GORE-TEX Trail-Running Shoes","Tackle trails with confidence in Salomon Speedcross 6 GORE-TEX men's trail-running shoes. Offering excellent grip, GORE-TEX protection and a comfortable ride, they will match your efforts every time.","general shoes",0,4.2,11.5,0,0,1,0.4,"High",3.97884141346024,10.2636191893676
"715",210019,159.95,"Merrell","Merrell Women's Moab 3 Thermo Mid Waterproof Hiking Boots","Serving up out-of-the-box comfort for winter endeavors, the women's Merrell Moab 3 Thermo Mid waterproof hiking boots boast PrimaLoft Gold Eco insulation and Vibram Icetrek grip.","hiking",0,4.70588235294118,8.25,0,0,0,0,"Medium",3.4844177851685,10.2315878578961
"716",210028,110,"Allbirds","Allbirds Men's Wool Piper Sneakers","Classic low-top sneakers made with premium ZQ-certified merino wool, the men's Allbirds Wool Piper sneakers add the all-day comfort and wear-anywhere style that your wardrobe has been waiting for.","general shoes",0,5,8.5,0,0,0,0,"Medium",3.09507176835704,11.6516881253273
"717",210029,98,"Allbirds","Allbirds Men's Wool Runner Sneakers","Made with superfine ZQ-certified merino wool material, the men's Allbirds Wool Runner sneakers are soft, cozy and ready for anything, making them great for casual strolls, travel and everyday wear.","general shoes",0,4.375,10.6875,0,0,0,0,"Low",2.61728380397313,10.7168867021777
"718",210030,89.93,"Allbirds","Allbirds Men's Wool Runner-Up Mizzle Sneakers","Combining a water-repellent shield with supersoft merino wool, the men's Allbirds Wool Runner-Up Mizzle sneakers are wet-weather high-tops that help keep your feet cozy no matter what the day brings.","general shoes",0,3.5,9.25,0,0,0,0,"Low",2.04482201635753,9.18978640773503
"719",210123,129.95,"KEEN","KEEN Women's Elsa Harvest Sneakers","Featuring leather uppers made from car seat scraps, these women's KEEN Elsa Harvest sneakers serve up an upcycled construction alongside plush cushion to keep you feeling good wherever you go.","general shoes",0,5,9.5,0,0,0,0,"Medium",3.31546182360465,10.9453187560124
"720",210125,144.95,"KEEN","KEEN Women's Circadia Polar Mid Hiking Boots","On winter hikes, warmth, comfort and traction are non-negotiable. Luckily, the women's KEEN Circadia Polar Mid hiking boots are the insulated, waterproof, grippy shoes that check all the boxes.","hiking",0,4,8,0,0,0,0,"Low",2.928812603872,10.2209869715707
"721",210130,144.95,"KEEN","KEEN Men's Circadia Polar Mid Hiking Boots","On winter hikes, warmth, comfort and traction are non-negotiable. Luckily, the men's KEEN Circadia Polar Mid hiking boots are the insulated, waterproof, grippy shoes that check all the boxes.","hiking",0,4.5,10,0,0,0,0,"Medium",3.20499061796675,11.1777562947943
"722",210190,66.93,"Sorel","Sorel Women's Kinetic Breakthru Tech Lace Shoes","Ready for wherever your day takes you, the women's Sorel Kinetic Breakthru Tech Lace shoes are a lightweight pair of casual kicks you can rock from the office to the park.","general shoes",0,4,11,0,0,0,0,"Low",2.06691625748511,9.60565943414035
"723",210285,49.83,"Allbirds","Allbirds Women's Wool Piper Sneakers","Classic low-top sneakers made with premium ZQ-certified merino wool, the women's Allbirds Wool Piper sneakers add the all-day comfort and wear-anywhere style that your wardrobe has been waiting for.","general shoes",0,5,10,0,0,0,0,"Low",2.4303665240338,10.7448031595975
"724",210287,125,"Allbirds","Allbirds Women's Wool Runner Mizzle Sneakers","Combining supersoft merino wool and a bio-based water repellent shield, the women's Allbirds Wool Runner Mizzle sneakers are wet-weather shoes that will keep your feet cozy in unpredictable weather.","general shoes",0,4,8.45,0,0,0,0,"Low",2.70842254862439,8.99506635207092
"725",210320,150,"Teva","Teva Women's Geotrecca RP Hiking Boots","Engineered to easily transition from street to summit, the all-weather Teva Geotrecca RP women's hiking boots combine recycled materials, lightweight construction and waterproof versatility.","hiking",0,3.52631578947368,9.25,0.0526315789473684,0.0526315789473684,0,0,"Low",2.79079143002107,10.5052703208905
"726",210401,165,"Teva","Teva Women's Grandview GTX Low Hiking Shoes","Tackle day hikes and weeklong excursions with the rugged dependability of the women's Teva Grandview GTX Low hiking shoes. They combine waterproof protection and quick-dry comfort.","hiking",0,4,9.75,0.125,0.125,0,0,"Medium",3.31141121273126,9.69096580288586
"727",210402,150,"Teva","Teva Men's Geotrecca RP Hiking Boots","Engineered to easily transition from street to summit, these all-weather Teva Geotrecca RP hiking boots combine recycled materials, lightweight construction and waterproof versatility.","hiking",0,3.75,9.5,0,0.25,0,0,"Medium",3.16871923878231,9.51057448972369
"728",211005,150,"Nike","Nike Women's Pegasus Turbo Next Nature Road-Running Shoes","Complete with light, responsive foam, the women's Nike Pegasus Turbo Next Nature road-running shoes were made to help you increase tempo without sacrificing comfort as you log hard miles.","general shoes",0,4.075,9.5,0,0,0.025,0.025,"Medium",3.07435841729994,9.98413670435079
"729",211006,160,"Nike","Nike Women's Nike Zoom Fly 5 Road-Running Shoes","Bridge the gap between training and race day in the Nike Zoom Fly 5 women's road-running shoes. They give you more bounce, stability where you need it and propulsion that helps you stay in rhythm.","general shoes",0,4.08510638297872,8,0,0,0.0638297872340425,0.0425531914893617,"Medium",3.22434658346522,10.015363889303
"730",211008,160,"Nike","Nike Men's Nike Zoom Fly 5 Road-Running Shoes","Bridge the gap between training and race day in the Nike Zoom Fly 5 men's road-running shoes. They give you more bounce, stability where you need it and propulsion that helps you stay in rhythm.","general shoes",0,3.86274509803922,10.5555555555556,0,0,0.156862745098039,0.176470588235294,"Medium",3.36041927209514,10.0073415087464
"731",211009,160,"Nike","Nike Women's React Pegasus Trail 4 GORE-TEX Trail-Running Shoes","When the rain rolls in, lace up the women's Nike React Pegasus Trail 4 GORE-TEX trail-running shoes. Their waterproof layer keeps feet dry, while less rubber means a smooth road-to-trail transition.","general shoes",0,4.48148148148148,8.75,0,0,0.037037037037037,0.0370370370370371,"Medium",3.43262267447285,9.83792700604
"732",211010,160,"Nike","Nike Women's ZoomX Zegama Trail-Running Shoes","Highly cushioned, lightweight and responsive, the women's Nike ZoomX Zegama trail-running shoes feature elite foam used in top-level racing shoes, derived from aerospace innovation. Time to go fast.","general shoes",0,4.61538461538461,7.5,0,0,0.0769230769230769,0.0769230769230769,"Medium",3.58369440867852,9.48507333046129
"733",211101,160,"Nike","Nike Men's React Pegasus Trail 4 GORE-TEX Trail-Running Shoes","On days when the weather turns, don't call off your run. Instead, lace up the men's Nike React Pegasus Trail 4 GORE-TEX trail-running shoes and get your miles in, rain or shine.","general shoes",0,4.48,12,0,0,0.08,0.04,"Medium",3.43753250583453,9.9416543465457
"734",211367,135,"KEEN","KEEN Women's Circadia Mid Waterproof Hiking Boots","Whatever kind of hiking you do, comfort, protection and traction are must-haves. The perfectly cushioned, waterproof and grippy women's KEEN Circadia Mid Waterproof hiking boots check all the boxes.","hiking",0,3.55555555555556,8.125,0.111111111111111,0.888888888888889,0,0,"High",3.71902950390444,9.93900045526917
"735",211369,169.95,"KEEN","KEEN Women's Terradora Flex Waterproof Hiking Shoes","Giving you freedom to move and protection from puddles and muck, the women's KEEN Terradora waterproof hiking shoes are flexible, tough and ready to explore every bend in the trail.","hiking",0,4,9,1,1,0,0,"High",4.49382135040892,10.4208042491959
"736",211370,135,"KEEN","KEEN Men's Circadia Mid Waterproof Hiking Boots","Whatever kind of hiking you like to do, comfort, protection and traction are must-haves. The perfectly cushioned, waterproof, grippy KEEN Circadia Mid Waterproof hiking boots check all the boxes.","hiking",0,3.5625,10.4642857142857,0.25,0.625,0,0,"High",3.38275719970574,10.1927276029073
"737",211471,150,"New_Balance","New Balance Women's Fresh Foam X More v4 Road-Running Shoes","Want lightweight shoes that don't skimp on cushioning? The women's New Balance Fresh Foam X More v4 road-running shoes deliver a smooth, comfortable ride to make it a breeze to go that extra mile.","general shoes",0,4.31147540983607,9,0,0,0.0491803278688525,0.0491803278688525,"Medium",3.25172355995833,10.5123539710658
"738",211474,140,"New_Balance","New Balance Men's Fresh Foam X 860v13 Road-Running Shoes","Built for the stability-minded everyday runner, the New Balance Fresh Foam X 860v13 men's road-running shoes deliver a pinnacle cushioned experience for reliable and sustained long-haul comfort.","general shoes",0,4.02564102564103,10.5,0,0,0.0128205128205128,0.0128205128205128,"Low",2.91307753855614,9.95680343579465
"739",211652,170,"Saucony","Saucony Men's Endorphin Speed 3 Runshield Road-Running Shoes","There are no shortcuts to getting faster, but the right shoes can help. The men's Saucony Endorphin Speed 3 Runshield road-running shoes are designed to propel you through your daily training.","general shoes",0,4.25,10.3333333333333,0,0,0.25,0.25,"High",3.82694350570813,10.7524674249364
"740",211653,170,"Saucony","Saucony Men's Endorphin Speed 3 Road-Running Shoes","There are no shortcuts to getting faster, but the right shoes can help. The men's Saucony Endorphin Speed 3 road-running shoes are made to support and propel you through the rigors of daily training.","general shoes",0,4.29032258064516,10.125,0,0,0.032258064516129,0.032258064516129,"Medium",3.42826717891006,9.9867396941617
"741",211656,200,"Saucony","Saucony Men's Endorphin Edge Trail-Running Shoes","Propulsive, protective and efficient, the men's Saucony Endorphin Edge trail-running shoes provide excellent on-trail performance—so you don't have to stop running until you want to stop running.","general shoes",0,4.26470588235294,10.5,0,0,0.0294117647058824,0.0294117647058823,"High",3.74002866009596,9.82850251349103
"742",211658,170,"Saucony","Saucony Women's Endorphin Speed 3 Road-Running Shoes","There are no shortcuts to getting faster, but the right shoes can help. The women's Saucony Endorphin Speed 3 road-running shoes support and propel you through the rigors of daily training.","general shoes",0,4.24752475247525,7.5,0,0,0.0297029702970297,0.0297029702970297,"Medium",3.3996879145962,10.6702774521738
"743",211659,170,"Saucony","Saucony Women's Endorphin Speed 3 Runshield Road-Running Shoes","There are no shortcuts to getting faster, but the right shoes can help. The women's Saucony Endorphin Speed 3 Runshield road-running shoes are built to propel you through your daily training.","general shoes",0,4.85714285714286,8,0,0,0.142857142857143,0.142857142857143,"High",3.95516901225212,10.8605765292511
"744",211660,160,"Saucony","Saucony Women's Triumph 20 Road-Running Shoes","The best runs are the ones where you can slip into a groove, and the women's Saucony Triumph 20 road-running shoes let you do just that. With their lightweight cushion, the miles will roll on by.","general shoes",0,4.49253731343284,8.5,0,0,0.0149253731343284,0.0149253731343284,"Medium",3.39598214192296,9.98996904951434
"745",211672,200,"Saucony","Saucony Women's Endorphin Edge Trail-Running Shoes","Propulsive, protective and efficient, the women's Saucony Endorphin Edge trail-running shoes provide excellent on-trail performance—so you don't have to stop running until you want to stop running.","general shoes",0,3.65217391304348,8.625,0,0,0.173913043478261,0.173913043478261,"High",3.68104946782764,9.17691146963772
"746",211806,145,"Birkenstock","Birkenstock Men's Zermatt Premium Suede Clogs","Featuring suede linings and extra-grippy outsoles, the men's Birkenstock Zermatt Premium suede clogs are excellent for lounging indoors as well as for venturing outside.","general shoes",0,5,9.75,0,0,0,0,"Medium",3.48172098808969,10.885894520317
"747",211815,159,"The_North_Face","The North Face Women's Chilkat V 400 Waterproof Boots","Tackle cold weather in comfort with the women's The North Face Chilkat V 400 waterproof boots. With their toasty insulation and underfoot cushion, you'll be ready for all-day winter adventures.","hiking",0,2.625,9.5,0,0,0,0,"Low",2.32453510903269,8.32396389825463
"748",211817,195,"The_North_Face","The North Face Women's VECTIV Fastpack Insulated FUTURELIGHT Hiking Boots","Designed for almost any cold-weather activity, the women's The North Face VECTIV Fastpack Insulated FUTURELIGHT hiking boots are durable, rugged and insulated so you can go adventuring all year long.","hiking",0,4.625,11,0,0,0,0,"High",3.82694350570813,10.6098399846571
"749",211822,159,"The_North_Face","The North Face Men's Chilkat V 400 Waterproof Boots","Tackle cold weather in comfort with the men's The North Face Chilkat V 400 waterproof boots. With their toasty insulation and underfoot cushion, you'll be ready for all-day winter adventures.","hiking",0,4.33333333333333,12,0,0,0,0,"Medium",3.26814332385642,10.1869194419801
"750",211824,195,"The_North_Face","The North Face Men's VECTIV Fastpack Insulated FUTURELIGHT Hiking Boots","Designed for almost any cold-weather activity, the men's The North Face VECTIV Fastpack Insulated FUTURELIGHT hiking boots are durable, rugged and insulated so you can keep adventuring all year long.","hiking",0,4.35714285714286,10.5,0,0,0,0,"High",3.67899099815737,9.81374097906062
"751",211896,240,"Lowa","Lowa Men's Axos GTX Lo Hiking Shoes","Lightweight and athletic performers with a focus on comfort and fit, the men's Lowa Axos GTX Lo hiking shoes will make short work of the miles, whether you're strolling trails or summiting peaks.","hiking",0,5,12,0,1,0,0,"High",5.82002817409191,11.6155250678338
"752",212047,49.93,"Hey_Dude","Hey Dude Men's Wally Eco Sox Shoes","Stretch-knit uppers combine with foam outsoles to elevate the lightweight, everyday comfort and slipperlike ease of the Hey Dude Wally Eco Sox men's shoes.","general shoes",0,4,10.75,0,0,0,0,"Low",1.87911520790068,10.056031434988
"753",212061,155,"VEJA","VEJA Women's SDU Flannel Shoes","Made with recycled materials and vegan suede, the VEJA SDU Flannel women's shoes keep you light on your feet thanks to a breathable construction with plenty of flex.","general shoes",0,4.16666666666667,8.33333333333333,0,0,0,0,"Medium",3.13189550356968,9.96957512578316
"754",212103,350,"Zamberlan","Zamberlan Women's 330 Marie GTX RR Hiking Boots","Ideal for backpacking and off-trail adventuring in a variety of conditions, the women's Zamberlan 330 Marie GTX RR hiking boots are durable and supportive yet surprisingly lightweight.","hiking",0,3,7,1,1,0,0,"High",5.93049937972981,9.31174614925026
"755",212108,140,"ASICS","ASICS Women's Novablast 3 Road-Running Shoes","Lightweight and responsive, the women's ASICS Novablast 3 road-running shoes will make the miles melt away, whether you're out for a serious workout or just enjoying a loop around the block.","general shoes",0,4.54,7.5,0,0,0.02,0,"Medium",3.17240161230357,11.0413098466033
"756",212110,140,"ASICS","ASICS Men's Novablast 3 Road-Running Shoes","Lightweight and responsive, the men's ASICS Novablast 3 road-running shoes will make the miles melt away, whether you're out for a serious workout or just enjoying a loop around the block.","general shoes",0,4.49253731343284,13,0,0,0.0149253731343284,0.0149253731343283,"Medium",3.17503973064716,9.92632679356263
"757",212581,150,"Dansko","Dansko Women's Patti Shoes","Looking for a slip-on that is made with outdoor activities in mind? The lightweight, flexible and supportive women's Dansko Patti shoes are the ideal companion for fair and not-so-fair weather.","general shoes",0,4,7.5,0,0,0,0,"Medium",2.98460056271914,9.84400530354104
"758",212680,135,"The_North_Face","The North Face Women's Cragstone Waterproof Hiking Shoes","Built for both mountain scrambling and vertical adventures, the women's The North Face Cragstone Waterproof hiking shoes are a lightweight option for explorers who are game to get off the beaten path.","hiking",0,3,7.5,0,0,0,0,"Low",2.26653772607279,8.62134939907593
"759",212999,45,"HOLO_Footwear","HOLO Footwear Women's Athena Moc Canvas Shoes","Take your casual footwear from the city to the woods with the women's HOLO Footwear Athena Moc canvas shoes. These multipurpose slip-ons are made for hanging around camp or heading out on the town.","general shoes",0,3.875,8.5625,0,0,0,0,"Low",1.75560839999751,10.2300588765866
"760",213000,100,"HOLO_Footwear","HOLO Footwear Women's Artemis TR Shoes","Whether you're taking a walk or running errands, you want comfortable and cushioned sneakers. The women's HOLO Footwear Artemis TR shoes are the perfect lightweight pair to kick on and go.","general shoes",0,5,8.33333333333333,0,0,0,0,"Low",2.98460056271914,10.9606731195081
"761",213016,160,"Topo_Athletic","Topo Athletic Women's Specter Road-Running Shoes","Find your stride for longer, faster miles with the women's Topo Athletic Specter road-running shoes. These lightweight, cushioned trainers deliver high energy return and a distinctive fit and feel.","general shoes",0,4,8.25,0,0,1,0.5,"High",4.06169481768867,9.8004170750874
"762",213017,135,"Topo_Athletic","Topo Athletic Women's Ultrafly 4 Road-Running Shoes","With a win-win combo of light pronation support and a distinctive fit and feel, the women's Topo Athletic Ultrafly 4 road-running shoes deliver more comfort on your daily run.","running shoes",0,5,7.5,0,0,1,0,"Medium",3.37124978245179,11.2316883304209
"763",213018,130,"Topo_Athletic","Topo Athletic Men's Magnifly 4 Road-Running Shoes","Get ready to run in comfort with the men's Topo Athletic Magnifly 4 road-running shoes. Featuring recycled mesh uppers and ZipFoam™ midsoles, these shoes are designed to keep you feeling nimble.","running shoes",1,4,10.5,0,0,1,1,"High",4.69690425010659,9.81054664661404
"764",213019,160,"Topo_Athletic","Topo Athletic Men's Specter Road-Running Shoes","Find your stride for longer, faster miles with the men's Topo Athletic Specter road-running shoes. These lightweight, cushioned trainers deliver high energy return and a distinctive fit and feel.","running shoes",1,5,11.5,0,0,1,1,"High",5.58067389520979,11.3892751173123
"765",213020,135,"Topo_Athletic","Topo Athletic Men's Ultrafly 4 Road-Running Shoes","With a win-win combo of light pronation support and a distinctive fit and feel, the men's Topo Athletic Ultrafly 4 road-running shoes deliver more comfort on your daily run.","general shoes",0,4,11.5,0,0,1,1,"High",4.75213985292554,10.2121556622645
"766",213061,140,"Topo_Athletic","Topo Athletic Women's Pursuit Trail-Running Shoes","The zero-drop Topo Athletic Pursuit women's trail-running shoes offer a cushioned ride built to inspire confidence on the trails while delivering a seriously comfortable, durable and grippy ride.","general shoes",0,5,9.375,0,0,0.75,0.75,"High",4.87641995926818,11.6861904604501
"767",213131,64,"HOLO_Footwear","HOLO Footwear Women's Maverick Shoes","With a lightweight feel that's great for all-day wear, the women's HOLO Footwear Maverick shoes are comfortable enough to handle light hikes and stylish enough for your neighborhood barbecue.","general shoes",0,4.18181818181818,8.35,0,0,0,0,"Low",2.13497656299493,10.4852571279491
"768",213134,100,"HOLO_Footwear","HOLO Footwear Men's Artemis TR Shoes","Whether you're taking a walk or running errands, you want comfortable and cushioned sneakers. These HOLO Footwear Artemis TR shoes are the perfect lightweight pair to kick on and go.","general shoes",0,5,12.5,0,0,0,0,"Low",2.98460056271914,11.2296559993326
"769",213135,64,"HOLO_Footwear","HOLO Footwear Men's Maverick Shoes","With a lightweight feel that's great for all-day wear, the men's HOLO Footwear Maverick shoes are comfortable enough to handle light hikes and stylish enough for your neighborhood barbecue.","general shoes",0,4.5,10.8333333333333,0,0,0,0,"Low",2.31072620832795,10.6562781392052
"770",213136,59,"HOLO_Footwear","HOLO Footwear Men's Credimus Shoes","The perfect slip-ons to wear when you're getting in and out of a tent, the men's HOLO Footwear Credimus shoes take camp comfort to a new level—and they can handle light hikes, too.","general shoes",0,5,12.8333333333333,0,0,0,0,"Low",2.53166861960375,11.3928478294865
"771",213210,175,"Vans","Vans Women's SK8-Hi GORE-TEX MTE-3 Shoes","Ready to take on the elements, the women's Vans SK8-Hi GORE-TEX MTE-3 shoes have breathable waterproofing to keep you dry, plus heat-retaining insulation to keep you warm.","general shoes",0,5,9.5,0,0,0,0,"High",3.81313460500339,10.3330906270356
"772",213234,79.93,"Vans","Vans Men's UltraRange VR3 Sneakers","Designed with a lightweight construction, the men's Vans UltraRange VR3 sneakers feel good on your feet and are made with organically grown and recycled materials.","general shoes",0,3,11.5,0,0,0,0,"Low",1.65817279662488,8.95932187404887
"773",213671,130,"Brooks","Brooks Women's Cascadia 16 Sasquatch Trail-Running Shoes","For runners who want a protected feel while exploring any trail, the women's Brooks Cascadia 16 Sasquatch trail-running shoes offer soft cushioning with an adaptable midsole and outsole construction.","running shoes",0,3,7.33333333333333,0,0,0.166666666666667,0.111111111111111,"Low",2.42610724532754,8.67412380006201
"774",213684,150,"Astral","Astral Rassler 2.0 Water Shoes","Grippy, rugged and quick to drain, the Astral Rassler 2.0 water shoes are an easy choice for hardcore river days. They feel light and agile on your feet without skimping on support and traction.","general shoes",0,5,12,0,0,0,0,"Medium",3.53695659090864,10.8553889638725
"775",214987,125,"Allbirds","Allbirds Men's Wool Runner Mizzle Sneakers","Combining supersoft merino wool and a bio-based water repellent shield, the men's Allbirds Wool Runner Mizzle sneakers are wet-weather shoes that will keep your feet cozy in unpredictable weather.","general shoes",0,4,10.5,0,0,0,0,"Low",2.70842254862439,9.56406657220789
"776",215482,219.95,"Danner","Danner Men's Mountain 600 Leaf GORE-TEX Hiking Boots","Merging weatherproof protection with durable design, the men's Danner Mountain 600 Leaf GORE-TEX hiking boots are made to tackle the trails, so you can get out exploring in all seasons.","hiking",0,4.51428571428571,11.0606060606061,0.4,0.8,0,0,"High",5.07248004660744,10.7563471837481
"777",215483,219.95,"Danner","Danner Women's Mountain 600 Leaf GORE-TEX Hiking Boots","Merging durable design with weatherproof protection, the women's Danner Mountain 600 Leaf GORE-TEX hiking boots are made to tackle the trails, so you can get out exploring in all seasons.","hiking",0,4.64,8.0625,0.48,0.88,0,0,"High",5.24502554874664,11.7222701915464
