"","productId","price","brand","name","desc","category","mens","avg_rating","avg_size","avg_backpacking","avg_dayhiking","avg_trail_running","avg_running","cushion","weight","sales"
"283",186769,89.95,"Merrell","Merrell Women's Wildwood Aerosport Shoes","Athletic and cushioned, the women's Merrell Wildwood Aerosport shoes are ideal for spending time on summer trails. Their ventilation panels and quick-dry materials provide cool-wearing comfort.","hiking",0,5,8.5,0,0,0,0,"Low",2.87357700105305,11.6053643457639
"284",186774,124.95,"Merrell","Merrell Men's Encore Gust 2 Shoes","Take your walking comfort to the next level. Featuring full-grain leather, breathable mesh and contoured insoles, the men's Merrell Encore Gust 2 shoes are easy to slip on and easily feel great.","general shoes",0,4.68518518518519,10.5,0,0,0,0,"Medium",3.08633636005938,10.7744928910188
"285",186828,175,"Teva","Teva Women's Grandview GTX Mid Hiking Shoes","Serving up rugged durability, waterproof protection and quick-drying comfort, the women's Teva Grandview GTX Mid hiking shoes were made for day hikes and weeklong treks—no matter the weather.","hiking",0,4.55,8.6,0.0333333333333333,0.075,0,0,"High",3.66123669725128,9.88880593528586
"286",186829,160,"Teva","Teva Women's Ridgeview Mid Hiking Boots","Wear them for lunchtime jaunts up the hill or multiday treks. The women's Teva Ridgeview Mid hiking high-top boots are crafted with waterproof leather and finished with Vibram Megagrip outsoles.","hiking",0,4.17241379310345,8.3,0.0689655172413793,0.172413793103448,0,0,"Medium",3.4125177615694,10.1656398783652
"287",186830,150,"Teva","Teva Women's Ridgeview Low Hiking Shoes","Not every multiday trek requires beefy backpacking boots. The women's Teva Ridgeview Low shoes are comfy, low-profile hikers made to keep the elements out and give you the support and grip you need.","hiking",0,4.19444444444444,8.125,0.0277777777777778,0.0555555555555556,0,0,"Medium",3.16360483111389,10.4090924196905
"288",186831,175,"Teva","Teva Men's Grandview GTX Mid Hiking Shoes","Tackle day hikes and weeklong treks with these rugged, dependable hiking shoes. The men's Teva Grandview GTX Mid combine waterproof protection and quick-drying comfort for fickle-weather adventures.","hiking",0,4.52,10.75,0.06,0.06,0,0,"High",3.62533355541896,10.2934064327811
"289",186832,160,"Teva","Teva Men's Ridgeview Mid Hiking Boots","Wear these boots for lunchtime jaunts up the hill or multiday treks. The men's Teva Ridgeview Mid hiking high-tops are crafted with waterproof leather and finished with Vibram Megagrip outsoles.","hiking",0,4.29166666666667,10.5,0.0833333333333333,0.166666666666667,0,0,"High",3.47098073198601,9.97577858676712
"290",186833,150,"Teva","Teva Men's Ridgeview Low Hiking Shoes","Not every multiday trek requires beefy backpacking boots. The men's Teva Ridgeview Low shoes are comfy, low-profile hikers designed to keep the elements out and give you the support and grip you need.","hiking",0,4.31428571428571,12.25,0.0285714285714286,0.0571428571428571,0,0,"Medium",3.23184564200397,9.85737991678747
"291",186915,189.95,"Danner","Danner Men's Overlook Knit Low Shoes","Inspired by the mountain-climbing prowess of the ibex goat but built for city life, Danner Overlook Knit Low shoes provide everyday sneaker comfort that's ready to hit the trail at a moment's notice.","general shoes",0,5,10.25,0,0,0,0,"High",3.97828905743205,10.6427882233315
"292",187037,240,"Zamberlan","Zamberlan Women's Jane GTX Boa Hiking Shoes","State-of-the-art technologies like Boa, GORE-TEX and Vibram Megagrip make the women's Zamberlan Jane GTX Boa hiking shoes perfect for fast-and-light endeavors, including ultralight backpacking.","hiking",0,4.5,7.75,0,0.75,0,0,"High",5.22164247688662,11.0418036615801
"293",187038,295,"Zamberlan","Zamberlan Men's Brenva Lite GTX CF Hiking Boots","Waterproof, breathable and leather-free, the men's Zamberlan Brenva Lite GTX CF hiking boots can handle a variety of terrain while you're hiking or backpacking with medium-weight loads.","hiking",0,3.5,11,0,0,0,0,"High",4.31025503037394,8.51763247712778
"294",187039,260,"Zamberlan","Zamberlan Men's Mamba Mid GTX Boa Hiking Boots","State-of-the-art technologies like Boa, GORE-TEX and Vibram Megagrip make the men's Zamberlan Mamba Mid GTX Boa boots perfect for fast-and-light endeavors, including ultralight backpacking.","hiking",0,3,10.5,0,0,0,0,"High",3.64742779654654,8.25455616374802
"295",187040,240,"Zamberlan","Zamberlan Men's Mamba Low GTX Boa Hiking Shoes","State-of-the-art technologies like Boa, GORE-TEX and Vibram Megagrip make the men's Zamberlan Mamba Low GTX Boa shoes perfect for fast-and-light endeavors, including ultralight backpacking.","hiking",0,4.125,9.5625,0.25,0.5,0,0,"High",4.69230128320501,9.48108449969957
"296",187177,325,"Asolo","Asolo Women's TPS 535 LTH V Evo Hiking Boots","Dependable boots that support your feet and provide excellent traction are key on weekend backpacking trips and long day hikes. Lace up the women's Asolo TPS 535 LTH V Evo hiking boots and head out.","hiking",0,5,7.25,1,1,0,0,"High",6.75903342201406,11.2675452652393
"297",187188,195,"Lowa","Lowa Women's Taurus Pro GTX Mid Hiking Boots","These light, waterproof hikers are made for day hikes and weekend adventures alike. The women's Lowa Taurus Pro GTX Mid hiking boots provide plenty of support whether you're exploring on or off trail.","hiking",0,1,8.5,0,0,0,0,"Low",1.82465290352119,6.93558029559519
"298",187189,255,"Lowa","Lowa Women's Renegade LL Mid Hiking Boots","Updated with glovelike leather linings for a luxurious, close-to-the-foot fit and superb moisture wicking, the women's Lowa Renegade LL (leather-lined) Mid hiking boots are ideal for warm climates.","hiking",0,4.25,8.625,0,1,0,0,"High",5.57146796140663,11.1163245364061
"299",187241,325,"Asolo","Asolo Men's TPS 535 LTH V Evo Hiking Boots","Weekend backpacking adventures and long day trips call for dependable boots that support your feet and provide excellent traction. Grab the classic Asolo TPS 535 LTH V Evo hiking boots and head out.","hiking",0,3.3,11.1111111111111,0.7,0.6,0,0,"High",5.30449588111504,8.17473196452112
"300",187320,180,"KEEN","KEEN Ridge Flex Mid WP - Women's","What if every step could be easier? Hike happier in the KEEN Ridge Flex Mid Waterproof women's hiking boots, designed with KEEN.BELLOWS FLEX technology to reduce the energy each step takes.","hiking",0,4.04166666666667,8.23913043478261,0.416666666666667,0.75,0,0,"High",4.30565206347236,10.5285545708988
"301",187362,79.83,"KEEN","KEEN Tempo Flex WP Low - Women's","Hike light, fast and flexible in the women's KEEN Tempo Flex Waterproof Low hiking shoes. Made on hybrid hiker-sneaker platforms with KEEN.BELLOWS FLEX technology, they flex and move where you do.","hiking",0,2.75,8.25,0.125,0.875,0,0,"High",2.64670596840802,9.60654482642052
"302",187365,170,"KEEN","KEEN Men's Ridge Flex Waterproof Hiking Shoes","What if every step could be easier? The men's KEEN Ridge Flex Waterproof hiking shoes make it possible with KEEN.BELLOWS FLEX technology that reduces the energy each step takes.","hiking",0,3,10.125,0,0.625,0,0,"High",3.4587061535818,9.22784549102155
"303",187405,150,"Vasque","Vasque Women's Satoru Trail LT Low Hiking Shoes","Whether you're exploring your neighborhood or have your sights set on the triple crown, the svelte, supremely comfortable Vasque Satoru Trail LT Low women's hiking shoes illuminate possibility.","hiking",0,4.8,8.5,0,0.2,0,0,"High",3.68425153175918,10.4125938733779
"304",187456,230,"Salomon","Salomon Women's Quest 4 GORE-TEX Hiking Boots","Designed for long expeditions and tough conditions, the women's Salomon Quest 4 GORE-TEX hiking boots deliver grip, support and sensitive articulation to keep your stride fluid, stable and smooth.","hiking",0,4.25,8.08510638297872,0.604166666666667,0.791666666666667,0,0,"High",5.02678354471976,10.6924644191552
"305",187457,175,"Salomon","Salomon Women's X Ultra 4 Mid GORE-TEX Hiking Boots","Power through uphills and descents in any weather with Salomon X Ultra 4 Mid GORE-TEX women's hiking boots. They give you the stability and grip you need, plus a higher cut for extra ankle support.","hiking",0,4.06896551724138,8.32142857142857,0.344827586206897,0.793103448275862,0,0,"High",4.32104819414316,10.2886916436433
"306",187459,160,"Salomon","Salomon Women's X Ultra 4 GORE-TEX Hiking Shoes","Get ready to power through uphills and descents in any weather with the women's Salomon X Ultra 4 GORE-TEX hiking shoes. They give you the stability and grip you need to enjoy the trails.","hiking",0,3.59259259259259,8.28571428571429,0.185185185185185,0.62962962962963,0,0,"High",3.68152384766935,9.19668751339619
"307",187460,140,"Salomon","Salomon Women's X Ultra 4 Low Hiking Shoes","Explore every angle of freedom with the women's Salomon X Ultra 4 Low hiking shoes. They pair anatomic design with stable platforms and grippy outsoles to help you power through uphills and descents.","hiking",0,3.64285714285714,8.21428571428571,0.142857142857143,0.857142857142857,0,0,"High",3.78157140339256,9.99850084226778
"308",187900,19.83,"Salomon","Salomon Alphacross Blast Junior Trail-Running Shoes","Get ready for more intrepid family adventures! The Salomon Alphacross Blast Junior shoes give kids all the extra grip and protection they need for off-road exploration.","general shoes",0,4,4,0,0,0,0,"Low",1.5465968789306,10.730140744364
"309",187981,60,"KEEN","KEEN Targhee Sport Vent Hiking Shoes - Little Kids'","Featuring cushioned support, all-terrain traction and vented uppers for breathability on warm days, the little kids' KEEN Targhee Sport Vent hiking shoes help them take on every trail with confidence.","hiking",0,4,6.66666666666667,0,0,0,0,"Low",1.99035971197804,9.91274174899345
"310",187982,60,"KEEN","KEEN Targhee Sport Vent Hiking Shoes - Big Kids'","Featuring cushioned support, all-terrain traction and vented uppers for breathability on warm days, the big kids' KEEN Targhee Sport Vent hiking shoes help them tackle on every trail with confidence.","hiking",0,1.25,7,0,0,0,0,"Low",0.471380634456919,7.43321699051753
"311",188076,159.95,"Danner","Danner Women's Trail 2650 Campo Hiking Shoes","Made for warm-weather hiking, the women's Danner Trail 2650 Campo shoes are comfortable as running shoes, but built tough for scrambling over rocky terrain or trekking through sand and sagebrush.","hiking",0,3.75,7.75,0.25,1,0,0,"High",4.24526113772364,10.6940450542746
"312",188077,169.95,"Danner","Danner Women's Trail 2650 Mesh Hiking Shoes","Inspired by the versatility needed to hike the Pacific Crest Trail, the women's Danner Trail 2650 Mesh hiking shoes (named for how many miles the PCT has) are built to perform on all kinds of terrain.","hiking",0,3,9,1,1,0,0,"High",3.94146532221942,9.49020062109515
"313",188078,159.95,"Danner","Danner Men's Trail 2650 Campo Hiking Shoes","Made for warm-weather hiking, the men's Danner Trail 2650 Campo shoes are comfortable as running shoes, but built tough for scrambling over rocky terrain or trekking through sand and sagebrush.","hiking",0,4,10.75,0.666666666666667,0.666666666666667,0,0,"High",3.95373990062363,10.1465878924507
"314",188079,169.95,"Danner","Danner Men's Trail 2650 Mesh Hiking Shoes","Inspired by the versatility required to hike the Pacific Crest Trail, the men's Danner Trail 2650 Mesh hiking shoes (named for how many miles the PCT has) are built to perform on all kinds of terrain.","hiking",0,5,11,0.5,1,0,0,"High",5.04617737859842,11.3902628057127
"315",188187,200,"Salomon","Salomon Index.01 Road-Running Shoes","Live your values, and run them, too, with the Salomon Index.01 road-running shoes. These cushy everyday running and training shoes can be easily disassembled and recycled when you're done with them.","running shoes",0,5,8,0,0,0,0,"High",4.08931261909814,10.9184890139923
"316",188539,110,"Merrell","Merrell Women's Siren Sport 3 Hiking Shoes","With a women-specific build and trail-worthy features, like grippy Vibram soles and breathable linings, the Merrell Siren Sport 3 hiking shoes support all your trail-bound adventures.","hiking",0,3.55769230769231,10,0,0.0192307692307692,0,0,"Low",2.32318962639992,8.99880973111448
"317",188614,150,"Xero_Shoes","Xero Shoes Women's Xcursion Fusion Hiking Boots","Stay dry in the women's Xero Shoes Xcursion Fusion waterproof hiking boots. Their natural fit, wide toe boxes and flexible design let your feet bend and move naturally to engage with your world.","hiking",0,4.25,8.29032258064516,0.53125,0.75,0,0,"High",4.08931261909814,10.7574007991966
"318",188616,150,"Xero_Shoes","Xero Shoes Men's Xcursion Fusion Hiking Boots","Stay dry in the men's Xero Shoes Xcursion Fusion waterproof hiking boots. Their natural fit, wide toe boxes and flexible design let your feet bend and move naturally and engage with your world.","hiking",0,4.28571428571429,11.2407407407407,0.607142857142857,0.821428571428571,0,0,"High",4.20109895813649,9.85329960271006
"319",188617,120,"Xero_Shoes","Xero Shoes Men's DayLite Hiker Fusion Hiking Boots","When you're looking for great grip and ankle protection but don't need big, stiff, heavy boots, slip on the Xero Shoes DayLite Hiker Fusion men's hiking boots.","hiking",0,4.19047619047619,11.1428571428571,0.476190476190476,0.857142857142857,0,0,"High",3.86310967422054,10.2293565323487
"320",188651,59.83,"Topo_Athletic","Topo Athletic Women's Cyclone Road-Running Shoes","Upgrade your run with the women's Topo Athletic Cyclone road-running shoes. They're fast, nimble trainers that are perfect for 5Ks, 10Ks, half-marathons—and every workout leading up to race day.","running shoes",0,2.6,7.875,0,0,0.6,0.6,"Low",2.37513092121485,9.55770813552707
"321",188652,79.93,"Topo_Athletic","Topo Athletic Men's Cyclone Road-Running Shoes","Upgrade your run with the men's Topo Athletic Cyclone road-running shoes. They're fast, nimble trainers that are perfect for 5Ks, 10Ks, half-marathons—and every workout leading up to race day.","running shoes",1,3.6,10.2,0,0,0.8,0.8,"Medium",3.53618329246918,10.110581811759
"322",188654,150,"Topo_Athletic","Topo Athletic Women's Ultraventure Pro Trail-Running Shoes","Ideal for adventurous trail runs and hikes, the women's Topo Athletic Ultraventure Pro shoes are high-performance hybrids built to keep your footing secure and comfortable in rugged territory.","running shoes",0,4.33333333333333,8.94444444444444,0,0,0.888888888888889,0.666666666666667,"High",4.45754997122448,11.0820081032238
"323",188655,64.83,"Topo_Athletic","Topo Athletic Men's Ultraventure 2 Trail-Running Shoes","Tackle mile after mile in total comfort with the men's Topo Athletic Ultraventure 2 trail-running shoes. Their plush cushioning and Vibram XS Trek EVO outsoles offer lasting comfort and traction.","running shoes",1,3.55555555555556,9.83333333333333,0,0,0.777777777777778,0.777777777777778,"Medium",3.30186159073279,10.9238480591652
"324",188656,150,"Topo_Athletic","Topo Athletic Men's Ultraventure Pro Trail-Running Shoes","Built to keep your footing secure and comfortable in rugged territory, the men's Topo Athletic Ultraventure Pro shoes are high-performance hybrids ideally suited to adventurous trail runs and hikes.","running shoes",1,3.41176470588235,10.9117647058824,0,0,0.941176470588235,0.941176470588235,"High",4.47921099193779,10.48393242063
"325",188805,89.93,"Nike","Nike Men's Air Zoom Pegasus 38 Road-Running Shoes","Meet your workhorse with wings. Designed to put a spring in your step, the men's Nike Air Zoom Pegasus 38 road-running shoes boast plush, responsive foam and wider toe boxes for miles of comfort.","running shoes",1,5,11.5,0,0,1,1,"High",4.80660215730503,11.9922869582193
"326",188806,89.93,"Nike","Nike Men's React Miler 2 Road-Running Shoes","Enhance your training cycle with the stability and comfort of the men's Nike React Miler 2 road-running shoes. A thick layer of Nike React foam helps you stay energized and focused on the road ahead.","running shoes",1,1,12,0,0,0,0,"Low",0.663931945883779,6.4960288220129
"327",188950,150,"REI_Co-Op","REI Co-op Flash Hiking Boots","Fly over trails in the waterproof, breathable men's REI Co-op Flash hiking boots. REI-exclusive technologies create fast-and-light boots—with a lighter footprint—that are comfy right out of the box.","hiking",0,3.75609756097561,10.9875,0.390243902439024,0.804878048780488,0,0,"High",3.88723114537028,10.8161831180448
"328",188951,89.95,"REI_Co-Op","REI Co-op Women's Beyonder Shoes","Brisk walks feel better in the REI Co-op Beyonder shoes, designed to have the least impact on the planet without sacrificing comfort. Perfect for dog walks and adventures of your own.","general shoes",0,3.975,8.19736842105263,0,0,0,0,"Low",2.30741207215882,10.1557017285353
"329",188952,89.95,"REI_Co-Op","REI Co-op Men's Beyonder Shoes","Tread lightly in the REI Co-op Beyonder shoes, designed to have the least impact on the planet without sacrificing comfort. Perfect for getting those steps in around town.","general shoes",0,3.80327868852459,10.5964912280702,0,0,0,0,"Low",2.21256077059677,9.2662936515883
"330",189065,150,"REI_Co-Op","REI Co-op Flash Hiking Boot","Fly over trails in the waterproof, breathable women's REI Co-op Flash hiking boots that are comfy right out of the box. REI-exclusive technologies create fast-and-light boots—with a lighter footprint.","hiking",0,3.49333333333333,8.47916666666667,0.28,0.853333333333333,0,0,"High",3.80454240012044,9.88752933519723
"331",189222,140,"VEJA","VEJA Women's Rio Branco Sneakers","The women's VEJA Rio Branco sneakers keep you light on your feet—and they're made with assorted recycled materials designed to give your feet ample breathability and flex whenever you're on the move.","general shoes",0,4.5,7.5,0,0,0,0,"Medium",3.15030737117599,9.53265767363588
"332",189223,160,"VEJA","VEJA Men's Rio Branco Sneakers","The men's VEJA Rio Branco sneakers keep you light on your feet—and they're made with assorted recycled materials designed to give your feet ample breathability and flex whenever you're on the move.","general shoes",0,3,11,0,0,0,0,"Low",2.54271574016754,8.56817874563783
"333",189498,170,"VEJA","VEJA Men's Condor 2 Road-Running Shoes","Everyone needs a reliable running partner. Let the men's VEJA Condor 2 running shoes be yours. They combine maximum comfort and a secure feel for long runs, easy runs and recovery sessions.","running shoes",1,5,9.5,0,0,1,0,"High",3.75789900218444,10.1714327460904
"334",189546,69.83,"ASICS","ASICS Men's GEL-Cumulus 23 Road-Running Shoes","Drawing inspiration from puffy cumulus clouds, the men's ASICS GEL-Cumulus 23 road-running shoes deliver a smooth, soft ride every step of the way with 3D Space Construction™ and GEL™ inserts.","running shoes",1,4.24561403508772,10,0,0,0.0175438596491228,0.0175438596491228,"Low",2.26853589823091,9.91853267376038
"335",191491,130,"Altra","Altra Men's Superior 5 Trail-Running Shoes","Designed to provide traction on any terrain, the men's Altra Superior 5 trail-running shoes feature MaxTrac™ rubber outsoles with multidirectional lugs and a light, fast feel on your feet.","running shoes",1,3.57575757575758,10.8181818181818,0,0,0.166666666666667,0.0909090909090909,"Low",2.70507493633234,9.17698825929603
"336",191494,170,"Altra","Altra Men's Paradigm 6 Road-Running Shoes","Serving up guidance-style stabilization and balanced, ultra-plush cushioning, the men's Altra Paradigm 6 road-running shoes keep your stride steady and your feet on cloud nine, mile after mile.","running shoes",1,3.14,11.3571428571429,0,0,0.12,0.06,"Low",2.84651155567177,8.86118157405716
"337",191495,130,"Altra","Altra Men's Solstice XT2 Road-Running Shoes","Built for in-gym weightlifting and lateral moves, but ready to get out on the road for short runs, too, the men's Altra Solstice XT2 road-running shoes are your ultimate cross-trainers","running shoes",1,3.77647058823529,8.5,0,0,0,0,"Low",2.64019033337745,9.64122786841855
"338",191594,130,"Altra","Altra Women's Superior 5 Trail-Running Shoes","Light, fast and trail-ready, the women's Altra Superior 5 trail-running shoes feature grippy outsoles and lightweight, removable StoneGuard™ plates to shield your feet from roots and rocks.","running shoes",0,4.07142857142857,8.36111111111111,0,0,0.535714285714286,0.428571428571428,"Medium",3.63164619574113,10.5436934623098
"339",191597,170,"Altra","Altra Women's Paradigm 6 Road-Running Shoes","Serving up guidance-style stabilization and balanced, ultra-plush cushioning, the women's Altra Paradigm 6 road-running shoes keep your stride steady and your feet on cloud nine, mile after mile.","running shoes",0,3.97260273972603,8.83333333333333,0,0,0.0821917808219178,0.0547945205479452,"Medium",3.29634122520418,9.46506127039746
"340",191598,130,"Altra","Altra Women's Solstice XT2 Road-Running Shoes","The ultimate cross-trainers, the women's Altra Solstice XT2 road-running shoes are built for in-gym weightlifting and lateral moves, but ready to get out on the road for short runs, too.","running shoes",0,3.80681818181818,8.83333333333333,0,0,0.0227272727272727,0.0227272727272727,"Low",2.70089042096726,9.08027891893713
"341",191687,140,"On","On Women's Cloudflow Road-Running Shoes","Ready, set, flow. The shortcut to a runner's high is now shorter than ever with the women's On Cloudflow road-running shoes. They're packed with comfort and kick to help you breeze through the miles.","running shoes",0,3.95652173913043,8,0,0,0.826086956521739,0.608695652173913,"High",4.02687237243324,10.1815123182001
"342",191688,170,"On","On Women's Cloudstratus Road-Running Shoes","Maximum cushioning, maximum performance. Dare to double your run in the On Cloudstratus women's running shoes, designed for those who want to go the distance and demand supreme plushness underfoot.","running shoes",0,5,8.5,0,0,1,1,"High",5.69114510084769,11.8765695504773
"343",191689,170,"On","On Women's Cloudventure Waterproof Trail-Running Shoes","Any trail, any weather—the women's On Cloudventure Waterproof trail-running shoes go off-road in all conditions. Thin, breathable membranes lock out water and wind but stay soft and comfortable.","running shoes",0,2,7.375,0,0,1,0.25,"Low",2.58414244228176,7.41080618062069
"344",191690,150,"On","On Women's Cloudventure Trail-Running Shoes","Stay in control on steep climbs and flying downhills. The women's On Cloudventure trail-running shoes are light in weight but heavy on performance, thriving on technical trails where precision in key.","running shoes",0,4.4,7.7,0,0,0.8,0.6,"High",4.36549063319289,10.7365203974683
"345",191761,140,"On","On Men's Cloudflow Road-Running Shoes","Take a shortcut to your runner's high with the On Cloudflow road-running shoes. Redesigned to be more comfortable and responsive, this latest version keeps you moving swiftly along your route.","running shoes",1,4.14285714285714,10.875,0,0,0.857142857142857,0.5,"High",3.91966041043994,9.73987295571712
"346",191763,170,"On","On Men's Cloudventure Waterproof Trail-Running Shoes","Any trail, any weather—the men's On Cloudventure Waterproof trail-running shoes go off-road in all conditions. Thin, breathable membranes lock out water and wind but stay soft and comfortable.","running shoes",1,2.2,10.625,0,0,0.4,0.2,"Low",2.59795134298649,7.75109731301371
"347",191945,140,"On","On Men's Cloudaway Shoes","Built to explore new landscapes and new experiences, the men's On Cloudaway shoes are light, comfortable and durable to carry you across town, over hills and back again.","general shoes",0,4,11,0,0,0,0,"Low",2.87412935708124,9.82333879488241
"348",191993,160,"On","On Women's Cloud X Shift Shoes","Discover the city in comfort. With flashes of 90s-inspired style, the women's On Cloud X Shift shoes provide energy for wearing anywhere. Pair them with bright socks for a fresh, unique style.","general shoes",0,3.75,9.5,0,0,0,0,"Medium",2.95698276130967,9.38056948394824
"349",191994,140,"On","On Women's Cloudaway Shoes","Made for adventurers who crave new landscapes and new experiences, the women's On Cloudaway shoes are light, comfortable and durable to carry you across town, over hills and back again.","general shoes",0,3.2,8.7,0,0,0,0,"Low",2.43224453452964,8.86075230354843
"350",192008,215,"HOKA","HOKA Men's Bondi X Road-Running Shoes","Spring-loaded with propulsive carbon-fiber plates, these men's HOKA Bondi X road-running shoes retain the plush Bondi cushioning you love while turbocharging your stride.","running shoes",1,4.39,10.25,0,0,0.02,0.02,"High",3.95674717233266,10.0523062360286
"351",192009,140,"HOKA","HOKA Men's Clifton 8 Road-Running Shoes","Unleash dream cushion and a barely-there feel with the men's HOKA Clifton 8 road-running shoes. Serving up a ride that's even softer than before, they're the ultimate everyday trainers.","running shoes",1,4.4875,11.6666666666667,0,0,0.00625,0.00625000000000001,"Medium",3.15548570894027,10.5380818720423
"352",192013,160,"HOKA","HOKA Women's Zinal Trail-Running Shoes","Ready to fly through the miles? The women's HOKA Zinal trail-running shoes let you attack technical terrain with confidence thanks to a nimble design, responsive cushion and grippy traction.","running shoes",0,4.26086956521739,6.5,0,0,0.0434782608695652,0.0434782608695652,"Medium",3.32321882347879,9.65475611451604
"353",192014,215,"HOKA","HOKA Women's Bondi X Road-Running Shoes","Spring-loaded with propulsive carbon-fiber plates, these women's HOKA Bondi X road-running shoes retain the plush Bondi cushioning you love while turbocharging your stride.","running shoes",0,4.26666666666667,10,0,0,0.00952380952380952,0.00952380952380953,"High",3.86837020782234,9.87177088067674
